text,labels
"Cannot switch flight mode. Turn on ""Multiple Flight Modes"" to enable Atti and Sport Modes",medium
Backward Obstacle Sensing is not functioning. Ambient Light is too weak,low
Magnetic Filed Interference. Exit P-GPS Mode. Yaw Error.,low
Weak GPS signal. Positioning accuracy may be compromised. Please fly with caution,low
Battery temperature too low. Fly with caution,medium
Accelerator is Over Range,medium
"Aircraft will not enter S-mode if powered on with the remote controller set to S-mode. Please switch to Normal mode, then back to S-mode to enable it",low
Aircraft GPS interference. Aircraft unable to fly stably. Land or return to home promptly,medium
Sprayer turned ON,normal
Aircraft flight control obtained by remote controller UNKNOWN,normal
Obstacle Avoided. Revise Flight Route,medium
Altitude above the takeoff point exceeds nnn. Always fly in compliance with altitude limitations,low
Ambient Light too Weak,low
High wind velocity. Fly with caution and land in a safe place ASAP.,medium
Recharge promptly,low
Motor or propeller error. Check the motors and propellers.,medium
Reaching maximum altitude...,medium
Maximum Flight Distance Reached. Adjust distance in MC Settings if required.,low
Critical low battery. Unable to take off. Recharge promptly,medium
QuickShot has ended,normal
Low Power. Aircraft is returning to the Home Point.,medium
SD card speed low. Change card,low
"Ambient Light too Weak, Vision Positioning obstacle sensing is unavailable. please ensure safety during the flight",low
Aircraft is entering a restricted area,high
Compass abnormal Solution: 1. Ensure there are no magnets or metal objects near the aircraft. The ground or walls may contain metal. Move away from sources of interference before attempting flight. 2. Calibrate Compass Before Takeoff,low
Another aircraft is nearby. Fly with caution,low
"Aircraft is landing due to low voltage, which cannot be stopped. You can decelerate the descending speed and avoid obstacles using sticks",high
Aircraft is now following you.,normal
Weak signal. Make sure the remote controller is facing aircraft and avoid blocking the signal,low
Arrived at End Point,normal
Data Recorder File Index is 46.,normal
Subject lost. Reselect subject,low
Unable to take off in low light environment. Ensure there are no metal and magnetic objects near the aircraft and calibrate compass,low
Aircraft approaching obstacle sensing blind spot and may be unable to detect obstacles. Fly with caution,low
Your aircraft is flying in an Altitude Zone (nnn). Please fly with caution,low
No GPS. Return to Home failed. Return the aircraft to home manually,medium
Downlink Restored (after 0m 1.2s).,normal
Intelligent Flight Modes have not been enabled. Enable this option in Main Controller Settings if needed.,normal
Aircraft is returning to the Home Point. Minimum RTH Altitude is 98ft. You can reset the RTH Altitude in Remote Controller Settings after cancelling RTH.,normal
Warning: Motor Overloaded. Aircraft will decelerate to ensure safety,medium
Set Flight Mode to GPS to fly safe,normal
"Flight control mode error, cannot start recording QuickShot",medium
Attitude is too large.,low
In Flight.,normal
Lighting environment too dark. Vision System unavailable. Fly with caution,low
Obstacle Avoidance will be disabled in landing.,normal
Max altitude reached (Altitude limit: nnn) ,low
Obstacle Avoidance Disabled.,normal
Gimbal nnn roll axis endpoint reached,normal
Tap to choose a valid zone.,normal
Loading database failed. Geo-awareness function degraded,low
"Sprayer turned OFF, sprayed nnn at nnn liters/min",normal
Descending. Exited Visual Avoidance System,normal
RTH Altitude : 98FT. Data Recorder File Index is 1.,normal
Command Failed,medium
"Aircraft ActiveTrack available at max speed. When exceeding nnn, Obstacle Avoidance is not available",medium
Landing Gear Paused.,normal
Battery error. Aircraft returning to home automatically,medium
Data Recorder File Index is 15.,normal
Remote Controller Right Dial Locked. Lightly press it to adjust.,low
Fly with caution. Compass abnormal Solution: 1. Ensure there are no magnets or metal objects near the aircraft. The ground or walls may contain metal. Move away from sources of interference before,low
Capture Failed The gimbal is moving. Cannot shoot panorama,low
Precision Landing. Locating Landing Point,normal
